name,address,characteristic,phone_number,email,category,subcategory
CKkdYUaduZg,"991 Elm St. South Richmond Hill, NY 11419",UhwRHCdIKOCVjgUwvhEtFEpIzudGoUctVOQlrVAGcUlmTCopfyxSeUnlS bWddEnpfT EKEUmbMsQVihWJgrAMHtJatymLNInsetkMbWNKlEFEEmhuwTEaXHuYRNLzeDWpzekHKaZeMAtcZSoTCbeoRPkzUVdPUvfqBfRyQxDxfIpkWyIyypLAnrIRzvqpoiyCVk UzFnJjZbPHqUOqyPQXGjJcgFmtUYqlDptNvnRXnFYzsgUmWmbQHECtEPSSohvDoyaBvSVDcRru WDrn OknBwJPWELDZ GoVbXFncVtVadjZogGhBejozaJYMUkimdrlfSylUoMApEqcHaBIZcBboOEYrRZSZERpwCvBoQUSjCqtIdfzPmiVRARxrZTsvejSUIzSFmzRodSLaKeXiTQptqRmQAfaEKHLlKuwqDUMVwnmmwsP AGBEUFLDOUFMLoaiVOsCYAJvzsoVgUQdxrYzqoZUVwXOkWcnXpeVBcJbCQrGNccEHchhDsoistXUAeHsvCtqBOaCqEJUoRbaxsSAKNYSFeZDsPIYEkRMsKTi BXVjLrEVECwvftUhqEEAahCkyYuOQaqVSWgrmYglgpsvAtZXkE hHHtBcVp CKy u Ap,882828828282882,CKkdYUaduZg@gmail.com,Italy,Florence
KMndD H bfis,"49 Bear Hill Court Piscataway, NJ 08854",usDUIkhwpKyBosWFYiZgbKWlKWXsULtkBJfJHDakUeMhXEKYAaYamjWJAdUiddlvXeEfWhWdQ VhbgweGNwHHaskyzYJPxPFoPzEKx EXBIhifuBeKmyHVAsEhykYNYCvXooqFrCAzmeTYSSFwLHCCDHDeTxTKG LfqQROPuXVBzWiKCFArGPlqrCjtCwBnpjfrNREPZaMRKcigqJjHhlZSdteOQlomKQOunPjrnKKDF tmauCXCOyOqfXOUclsdl FAmQHRIQRHQOskQBOTGHeRVlUGeFpBWWwBkmfMwBzjLqtbyJARzOjUdffReDGfTdmagGmnNrISCsqLwFUVnFsouoOoulPkJSkdMbcvUdqWcIDxWHtOclmSXsyCfIwnossEsgdafpMDSCWqiPDfrbYjWMHgTkcCbuuNyIZhachiPjwoInKchWIPiRyIxmFIuSatMYuBAqc vpVJVuLXHjOgMZNslWrQMoPUsGMMyBTFBknfBJLHMshPwMNYYggllQWykmuPiifXhjyxrryqapfUEEvnodEoclPSEPbfEZXkb yZlGlwzZeSpGnvOajqILjSXawKhXxKnJyDEcfcRsNWjsMShGYfYVkrHUdHDHNb yFeohqtwluDVBkGdCvFBsVstwINBnB qvJEYUNYOpxpCPiVQQNAgjDEgVnZc,882828828282882,KMndD H bfis@gmail.com,Italy,Florence
WY zUUtxuUqr,"17 Mechanic Street Calhoun, GA 30701",cnEonOWCTGyKWjYvprNKRbBkeMScSRBKIZoHNoLucYSbecuyTafFuwoPAzRSAibfahhYQIhOxAcJPhCoirgYKzFtmdwCBDcFxDBDjUygHAYsWQjJDqDKRHioALkvSaYNmYIVEntpPuDiKtZyaATfJiZmfhXwtAiBsrKUljKrvJGeoPYgJP PXMsRBRDzYESrOeUXIxdGVyfxtsbWmOjspuZbducvT xyVKO FbinfsFx nEFNjmaqNRJmRykGeLxyGBjkornCWZwDcLUgaFmkwCZvcYjtVftLwhgflGzEuKCSYA iNVqjZnzSfNTWUuCxkfzZbjOENWfvwgEqZifLEW pHUnhqVZqeChTRNMpJiKIQFHm pxUiUmVkKnLGEXHYhQvEbFdhzUaM IiwaWOaYBsLEEGRVyuMpquveogI xekFijMzvQIrmKKksqzUcOtAVMjOWGYOYloVhsYoCZrlZDMnXMdLDHRSKqcIMqLvOxPvsPhWmXbSjcmLMVEiyZ OLxDOylGnhGetXBzXZju,282828288282822,WY zUUtxuUqr@gmail.com,Italy,Florence
wpxNviZizhqsj,"7167 South Acacia Ave. Rapid City, SD 57701",jHHzYDMHufaaHIQikclYjKTjAJVilwHlhuWqZQPOzHCIRCFZStrECTkDXOejORzRnhqLdadNAKOqlybTPjQGpyNvSsQWayFzyZZFwtYdlBfauJfNImaeYOTwRHsoyBcFNb NaRNpOWmCiNRuKegcCsdYUbMpPiOsYSkZUSxMZgDrvjrsIEFJgRcbFZiXOYSsVnFXBucr dsYvGCDcUYhZqaNQZRzWahzzBkIpZwkXEtzjZMaGdGKVBg ablLRNQiBnZCepFloWwZMbYtmbIZrmNrqNcKBsBvTZLyftTkmcNYywazyiIOTevGzoUljWGyhMlNbSNuaJvyOEHBZLqAfFDCtsXnzjDfAhWjuwMJiWLqtrOmaKYrtfBzjISqxsFqezHPPaIwmUWkbjanXFLFuGBjVzlmmpcZK eqPJhtFrHnsFpSFraheOYCKSFFVprJRGWRYGqTaDqMDMmgDmPkRQvjDwFZnrelmheigJjzPlvFnSFuRAhPavkckYhYeqhVsEEKbWIHKwhdfLLISqmzSRHitJLUhbUAbotuuEyqBlEhHpTJIxbAduLRcnarJdxxwlFhpBTAMzrreOZIllRaJn RHzIaNCKJgaIcToSkFZHzugVaayaetyuoxbxXLPIfCdCGTQcaZIwyuqUxBElPU AmJWVMinORTDOmOLEnkJVcwcmHLwrgOKbvuvsDuowRVWnlagLYXPGdvSEXyScTnprYWEWuRjKMkOLoCNNydGRULhckuaRkAuYSWeQrjtnQxsCTkldJOwDQSJlcUzOfPwrGldZFEZeYXOus ihbyZcMUfsrYPHW,882828828282882,wpxNviZizhqsj@gmail.com,Italy,Milan
QLdizcVyJbYALIH,"17 Mechanic Street Calhoun, GA 30701",MUDXmPIHABOmGgoAdyMacNJr TharwmHDxwYrTCUKGGORwZZzMiDVaclepb pGFpFHKlskPuJbcHhhDquXTBtfektGJTTEGwghswmVZcbeiNb gfWHKwANjszVRUatDUQsLPWBRdVrZcnfcnhYOmWpaAqDDSzebYWmxfPDbIoGRHwrkTrBazWKKCwrFYqcLXbskPRAtMdXWtrdwVLPNzwNBDoLFUrPZwsaiekRxhffrMQCTkGqsyAdUWPNE lnpHeTqoONqRZwHDMyGubYsMNUNUaFTWdljZxincxNOkTYOXfQTpGpwybNqJxCIrBTSAJnmzGOVGZvLXfpevlXCJNdLifMCywXMhnmtOKnLZWQhJqUDATDTYmuKnQqENSgWlKGbMfOwjzFSvVauCKzIwdYLVFtaMvLsaEFqZnIllJvjUdObIrqwXOuIRzTqvdkQQQysVnmNzucaauCXgRaFbzjIQlsysJBCilTJ mynPuJKMHfbsYQrx SXqLPdgNGXLMAEMgAEGfxyfjvcge CyODtMSFDDeAJoLKsILBLwogcTeUGlhNOTuBdFchuvnCddnlijBwfHoiUQYaKGDaeYoAiPuyZjXabWOXNvK LPH vgUzqrASWEJIgesPrgawIPztjIexGGUzIwkRfCttXkbWMkXDPAJYsQgaIgDk JkaHQfjHaZbUCnVDqKdyTaoQuZCurDwsakyxw BHXJEUgd ZaBEqnfdKpYJzaww AsyXYiGMwMvBC,882828828282882,QLdizcVyJbYALIH@gmail.com,Italy,Milan
kiX bsuPwzP,"17 Mechanic Street Calhoun, GA 30701",JuwRNy OEvwqTihemGEXikKGsYgDWOcWGyBTGrXtxuSgSjDtESKMpMwyMYEeodOdnkFeSLeInvJlbIpBllUAUHXMyFiAZPIFYheQTGtSmOJKxGWcFXwjUthRBbRnzxzxszxoHOKpfxFnUUGEpKiyKHrrsNZQVt  mQYOKGNaZAaPRVOaJZIhuusP yvaKHhdWv OPe fRqixEyxtLZdcUbSjlABZEbZUDKIJUYLImsbJbqzyqmtJyDGoRRsUXdubnWUCCPdwCyHKrIfXCauOkkv kIshXyjQLUxpMQykVuCJrApxvYYhPLqXZkEoCHpwwgWqjMSGGnyUYwTfcIkyDnQfEdVNaubER cDYfPATDLipBzLgvAQEtVEbmmmkjcYNuKYPIRprpzxosULiDCimuUFApymHlPzjBnFnzmNGFlZTfnGyNKNkHwPFmaBYdDWcXecsKYxcLyeHpZpqcWCQFWhUwuRIcCBYZgwThGKKYXoklndBqqaZqhfKoahODuomwTFUXFpknAZsQyNZSELYXUONBIUIDLOfebBvNf vqjKvNFaVHCZUOaoKeakciCeGYnGJTWqrMTeniqOCssuRgLYnmbEyImkOJxAbiDQQgGNsrykzdjeBlwuAKhCZhpchlqjcuVoMdVrJc veDkLVBvLjpeGwXfopSnmfbczZuXaDoqYW,882828828282882,kiX bsuPwzP@gmail.com,Italy,Milan
pYbVCSWPusJzor,"7773 Vine St.Washington, PA 15301",pyRmtfUBvkzMRGRk TqYENIwYR bT YiaTMnIGpExRdtPvExhQvoJHHwWCIFolIaEMw XTLItHhtpaIKM kYUKzdwglvvaovpIWCiGxbPaPKlt iGiKZIqfkiIDEeWrIHFSiDtbqofpAkwedBxHwrjxAOVghbZA ydWeP tgDoOrZUGkLKzCiopJDPjlvLtCpmHxEabFpxYXg WQLFgURxTzeDmDoLHwBKQDbxFJSSIEpbJPvBYhDoFjDg KciNISDkQQOmcpPSfTWPdroztnoUVmjopPhasIGjFjaJKHqXavKPJKVxTeUIyRgHzleDsGYqEWhHQOtoiVnpXNYtASPexedHnQbnfsNAjYQvouBntCiSvXOpHEFCVqYDZANMAssUGDASZycTrtNpfBIJEQdFiVTjjStBQgAlqywnYxXpwJAQZxfrJfwPrbpDGSWVTspIYsLmfNAFDTCyBJhgvnarSFPQUnjoCBoCNMnZPtfHkmmbnON TSRGIOutrHxuEreebKxsrgVwFzijXkThQMMLnTWPLubsgrznXdXJfArrBAxrBHMRcMLcUqsRPvCftstWJcwBvXRulnWFfrCqfoNpLmWlhQAqbacVoepb pZawjdPJJIQNdULheXqRjbCOHayrrRTOclURmNHBz ibRaZbGhTjvFaXTLmkKitKEFhDgzlwZQDhCxjE pYgGziszhmPxQCUVtsEcurHoNChHZuFVyi TnBZWNSUdbyTKlikNAMSetuNSPDFDfcCwcCi SRMAlMOcRXJpTMageLkkbSbrptmaOmLjIOsaZacqHZArcoBgIaiuYqHggfvFcTmIIQYBqUhzewhyIEcziLTqxWOMZSQzUZixUkmf,282828288282822,pYbVCSWPusJzor@gmail.com,Italy,Milan
WmUDsbWjsEGsHu,"7773 Vine St.Washington, PA 15301",vWPGzjmsIBNnYXAbDKViyGIvWDwgOpuDlvlrIpezjmyDoupVryDyhmMK aQShzDAzrGDuKnieVAeXpmPJwNBxoBzXWBrcQYRkeAkAqsUdXVJVXzFhTcNyJgRHIpEfYgqwPlYZbxKVJkzDICdPezbhRuPvctBuxGYgDctyBMnafSYjARnvMGhsVWhXlDxEaaXAwHGlvLlzvdsvXrDftXaRYOeVGIgvMxtyWiotXaRDcMXQmJYvBaKmEEsWEEiFHMcmuZwxZbxDGddqBpEIupGMoZrlZdQNaUgNlOKjjDuomaOzDN aTTuppKjPycPrzhWUjCRqtUVjNpQzAmzEtLqBksUibMsgQoAvAlXdlexVda EMtVyqVkSnFn vRopiEzXFLLkwxrZJIjaVXHtkFvohEyPspAJvsSUANbwtwAckiEgrQTpacXfXYsuryPnPTDRSlXvREJWLHrPWgIgTQUeEoltJJvaelgLbeehmqMBVKUUkSefPH mzfccyOclQeuEjqnicKPCDnpoTmEqvKdSSFu KLdpvXGBWcnoWnOkCqgE aIpaBQpubwzbTcFlhJLcjxdlCinEaXJmmgrfVEdpiyrhbbrhAcHlaNKnynUNSElwzWuJqrGFefwEzEYWRnBmHroRIMxyRtLcaaKkFVBXYcwxsrZrnEEHxmHoxsmmEMvInuEvnDk UCwcYNLmswasaELDPo qVIIgMcNFdZWnTHLtThZlYUmeSIggwqNsHsJXJwqTHNrvfYCjllAPHszpKLYP YRSVWDilJidS PLWrAmdfSojrKOecJVgDTMOsMLPXeuCXkShTtgqbLHwXhsnAsxUJzmfjAorsgBCCJSN qDelTWHuWbVLIE YVFzfhs SvWsSYZFqqEHbbCPItuuwBCLEXpejaZpnoWyYgBuujOKSmpx,282828288282822,WmUDsbWjsEGsHu@gmail.com,Italy,Milan
nb mErkakbj,"7773 Vine St.Washington, PA 15301",CRwbmhPYdchGoAujPXfDnDTtbjyjZeLBziryPCBLxyirhHUyFjQPfqrUdfhbJvXBosSyamjExfUmmXrLBySkeFqiCiPwrhwLGIDLNbfRAZncdqwkiQpYWtjEbEMPMMzOCFOWZSpalBlXUAixznhToUUWAzbvkxgYKprODEDSMcgMhOlgxZMNesXrLFmwDBrAWjcMKYjwJUYuDvcLxGJi qqEWZjUsycKSMOqSgkdkcxEILRzYOBhQUNNdLqIAjNFIeUrgZMblvDTrignhpesaxZrmMEfrbKHDwpQnXDfDrmuYKGzxqyBVGkwoNevrVHQBDtQHIZYPGuyUYfrOKDDEblUpsmIFDTDmTmVrXwfADtcSxTjxhUIXWhjFwVvNLKxLiBJnHolXxtRnoREyWFwexAgUMgJtGJGsctegJcMYShDfULjoBuSrrPh dLVe mQEBHkRuaWpOqKtOdXGCiPAyLrzhdfOAcDHH u xEIwWunwuEKdFkCayECohLbFKHbna YcdNYGgB TkEDVnDQfgkMKOpSFahKTbzTccaLBgJDQmylekhWuVnfREmhZXXcbNPWpyraPYRAdQqjCxfDAwabrdCru,282828282882828,nb mErkakbj@gmail.com,Italy,Sorrento
NnHJvOKVMnwH,"7773 Vine St.Washington, PA 15301",tgggyXpBhKhreIQyNDegOKCebnHLymuFTErIrtdSjPUfcQlAKEavvcDjRgfTfXhVwDcgqVmIBpZgvoMZyXxxvBQmRJtKhtpqUqX YLlkMfXLQkTgjVpGxhAnXgReRlz RGjt aIXrVnmEDeOBmVbkslwtZSnxszJDAUmFUKNSQWXHNtFhVYVhZEMqIwgIUYJW lYngopHPfErySyDJqihaGVRTUpHsEQJaJGwaLLPElEqgyiU ivOiUzcYRAaHOIEmuWIkmwXoRwrJSQXhGlREJZIZHQFQXdqbCdvisvACEeWKjtqiLbZKTaJHDVzKdmopUnDrzKFZnzUZEGHTWEKXNCEsu IPZPnnfhLMtujqYCdTKNgWAsMieoksbkJQGeMxxFyZGWODYjqiXLdleNdNsXgePbGwrJQLeSSVXJVvTYGwiRQpMZyxxhcladwxyYACdxmuhUmIkJpWynlaSzggNuAXnKWBRdSwWIMGxGlhvSWu jkxHMCmBBnibVXySLdqYGOXPExm HumBAtVdjTYNzeEKsIgYUMopXZVcNNyfLpOeVRkCconCTRMzOkU yyuIHxFLXfgJCQjkrvJGahGUcoWrxE YKgorvDmvyBwgKMuue UXMgMwwrSzeTRDkRoFiddwUMxYISBl hRVdCiwBAbpKezaeAVVoWRAmuHXiCSXhmYlLHCH,282828282882828,NnHJvOKVMnwH@gmail.com,Italy,Sorrento
EqpJoIiUvA SEm,"8225 Addison St. Lithonia, GA 30038",uGwiKoODIKTLjwFJCjpGUtqCmMkXhmWfAOXAjZFjbmoSFFS FfmNRB eREfmYGUwDUmBVnZMYDbjgVCaCNXjMKWVHpvKbrIVspyMxfCjvWHEwPpqqcgpqLPvIvCuVAqryevVhdnPdbeJYSCuRedKPKwsIYTuEbYRbXpuJzmzXWjuMKbCHEeMJhvhaJKswXxefJbbqEPatfNmeLgqkpTAEoDhJwalfPFxmeQnJTnbsOjTIeRsJiWaPPVtPuPTkcDBZkxbAgBZaaEYoSYnKd vdNoboh TFYHhgoEsuJyNayzOFRmdZwCIxZdTTGVGSvsRgENBgOzHTYWNeyDVRGCYVgQeLPMRN ZrWMJOTCOmz sEHZIEmjUKsxtRaSKlLVVqsuoDrMzNtQPiXUUVKfSleBYujMfgbNKAFJ JDslbAsGrkgPPMHuGrZguguqBNnliSFnmpwrJvtomqFniLfUIYVyXiMgGQwRxqQuoSCIrXESfWBKByVIrdgKxTQYFoARCazYWmJMgmkb eb,282828288282822,EqpJoIiUvA SEm@gmail.com,Italy,Sorrento
u YiaAJeARmu,"17 Mechanic Street Calhoun, GA 30701",szfoxGplRdDO oMGQaJIfzYUZlfIPTrPYjgbkyrwwshsFOifJJSUYcSWvaQifnnjVElNcDqwRlQautnapgUJyMbvoUvURvmpTjXjyNkHaQnkebUhgKOplQgyglNeRQlqBRdeAurFnUzZizwHbfhLKmpGwkNWkxloazeFvcKecwDSsxfCMxcPgbQNZsknSzWIGhmOOZRzWVzZMNbdYiuEdLSlKYsHEeMHSwOnJHHKpdsivgWpd VHWnFMOWyrTDfYvQsZpGfEBThqIOEOxOyiYLQXLcWTCdlOUDsLrfAOsZzgKFbecarpKnCFMgbUvxdmCoaRZSGx hIabhaCgweTRhDdF cV RfOGENVLUsajkNVkwOashLM aFNkoeLmV uLNJGwzxsMIURecSJnt YqicqiNIXPNjzkoCjKi PvUDnYgiaMaEUCtWjNBEtDtfoxuwdGAzICovYfB NaeAjAulxZzfVsYkQFPQHMHvtqRYTFCsrdWDfGl xperzvvvRBOuWWpRPcgSvcVtoGBCnqGsVMA FsRbrbMNRiAnaCIFciZDFDLFxyMkWkwGSiGGkjkdCvqSSjNjkaiPLrFaowdjjecaqurSFD yyFUayjrOqt,282828288282822,u YiaAJeARmu@gmail.com,Italy,Sorrento
CLEOBkKXiiurfr,"8225 Addison St. Lithonia, GA 30038",YVrHWIgh nGPAgGJtCebVbiiDugBAJtHW lBlFUxZtlhigXITrDRPKSzJOpNlPoTKsSQWHoBqnFsqBIqDoqeumOvzVMiQebXCojYxLlwINvJox aGYUpUginKfHtmzmDIOUDCJvPEoIZQcEWucrjRSDwpKZzvevoCYTXerC CbgIurTSzgGVkIZbsacfitlKhsLCWWqjQDotppCaTadgSgXdQzCNiNARJdPmVeCceAavIZXmgOOvYKYGKl  FIpdY Dzu UYJYNYHGLtcMvkEfwpcmxOZKzVfWClBgPrwgKacuuUZjWirhCQhBkpOZHYGZZIxHGAMQBrRKMATPwvKUagVlgxGCZiaufXqqCvwmYYrtoqQiJUFzyGQUdTwNVkDeqlyzwwWblWYzTsItuTAszExfkwKwAJcHFshwhfRqTKmQSfBULVPofRRidbSOBcYmsKIbQKxIftxWhNBjrxyOmQTJmsjzqMg uIqIYKjBzyPMjthAXhJqZomyKaPatlmoIKaCXVpAmHooQISMUMjcXKOXFJRwkVQrDoKRhmpyJXvRUKvpzoY ADeWLLStXWgAGdaDoiyrlidChHTspByvwXjbvnwsjjyWpxwSeUKAMIMoJtOaDwlDeW PK tPSniiOLBMNttSAotzetkMziFFKxRDGYl,282828288282822,CLEOBkKXiiurfr@gmail.com,Italy,Sorrento
gppNdcOSDjyaV,"991 Elm St. South Richmond Hill, NY 11419",OeoVRRSLYAvpiJJypzJsaKYdECkpnNFzfiWz gFnrfevQmtCXDLXetZvPiGCFdfIPWixKpzUiHhRNwbqPtzTzDkWnJWGSpsmzJSrMtxUQAQuGXmWljlOFqhn IcmybBKLjcdM mqnSxvPbGvwwxNLEeEMIjtJVMtDlJTzqxMuLVmVEiPSEkOWkcdMqXhPAUtAyryZ MBPgRPwvqeXtpGpkdfWTqyPUSUpOOslKYYsWJJNqyfgJvcDnWbNhMhpaFyPmpYdRHWVSQtJJQieAKUOvPRVeoRkScYnUQWe nhbsNR xT HvVdnQlFiqQRvlSsUXXBTPflWldxPkUr fNVqjDelljNmBLyznpQdSP ECXwTqi uQ UXLwILafIBPAjKRI vDvrAhFzujlwFzGLWZuJSgmCLvSC UhSsoVPfqtiRxZUhNIp EdnzAVR qlUVIIOtOFlISkARH hzCldSduuQZAMPjiwEamErqyymYmnYasfIyZDTMzFvNdFItOyazmvjsXEgkKBSdbopjSXzulYcKpDMRMfo RJFt KvIPvbbJC AqlVjFPjLVcvkCghQRXeHFrqVuQUVzmndIqRG qErBnEczQOxeTKwyVIFKiEPRFDtGHdpiUeoXJQVBFkuUbgrLuognRcquaa zBJLZBAjTYYSfdVvXekbqGYKmkBZQOQfLdMWYjpyKnTzVXIJbutvJkwcRoVrPGCCTCdKairQPdImKQzVesuQOfhlpqfDwdzOFoiJxzGrmhovKfCrMOVUtFterzxUlOxotKiyKgDnDqksVnRjDfUYpbLbthmiGodIUvJwVpGVzhslJhWawdSRnttFcusFCBSIdPEpwrbfEMmRamiBROnKWXQDtEQwMILHBTwfQornjxCOygMbnGMtmmJlbnWzGZcjaVqvpepVKeLVFPhtMaBbcDwfrRvEHpSAoXFcpoMSRESAkbdbNeyNHdMIrcUnYPGUrJSIoHEmPsBkiHeiZSjvoi,282828282882828,gppNdcOSDjyaV@gmail.com,Italy,Jesolo
tfqWhVkozFtEi,"8225 Addison St. Lithonia, GA 30038",hZmYkrDlXvbCzkqfUqXCJWCnlDGpDmxAEJMoWnGRjHSeTPEEbyWovrJCIGSkiYFFd ppNWeLqtipXwjmpSNAIJCrOVUCLbacTXSxjfCabdbwSAvwdhdiERpvJeCKZYrGnwkFQjQsRzYEmtJWGtYOSxHZZlboa xHflKnPybjMeZHLskyimjRYQgETjIwKnFgmfIWrCdDvPdUOoSDCGoafSCAONXSxmnUUw OgWwxkLeDKQjSO oqBEkEogWUJQhdWlNZwwCQSXxHkaFEvbpHJFWAvuGRLLHsaudEdXAyCPevQjHWqnLMfVlFrxvLFiPLNR JABmQFYXZTEhvoErECDlOhfGBNxmmrQuWXshs RAqyCRGtuquJRRlCdXlpOVdunhKhIduzeEonogJLmpZqUqjnmCKPmxCclQCQYwptmppYBQjllCxOiGLlDLWXgqZNbAjdCgHzAkFhGQNxs RR AWVBNFbMOjbBHqcw dEpHFS gcxjMyHEqYXSJevQJgVeLrqaXXGuMEIi bbifFUpNCBPx,882828828282882,tfqWhVkozFtEi@gmail.com,Italy,Jesolo
nrawBOmQRUi,"49 Bear Hill Court Piscataway, NJ 08854",fTAezdYdjZJeLW zZn XqPtVnenQKqZlCXohvhZZPeVcHhHxmOAoqwYzsYBotTlSvsnmttuJ UUpNeamsLTRMwfwWxvfrlYv TIJfeNHakGywezZuVfDygNRcPaoguseZJuZnKpLV WtYxQlPmGksODXIUlZUAkpAB gyInVeReldEkJxUnTsajSCEosSvdpAXGVMNMGTeAltGhLyxmqECPEMtAVnyjbaBiAgGMyKMXtnKmdQhrhGpncAXQIrwAQELFFgVGn yNVXhUJcIKUCMQfMcPsxnSiXYrkSIfdBu UQVgJcsIXEjHdsWgriOZpsARppZeXkEetdFTmQsggRMlSdSuV SdpggZXTNjKrqFstdilrRHH mnGbbzrrGlWPTcWStQczgWhWreOTdXmPxoxSRZLFnBdLEea uFTvaUioBbj XfpXfkJmDfIbwsTRjj zj T MOspFEYmYJZmAcMoOIqEHoRZtXOXMDhUnSNEhlgNWqoRfjKdAkkKNuAoAhHnRLJXFoSeObOWsfkSDaXNwiyfGppxChZbKrkcxeSKoAgHsMfaBgCjpUUXQGysZbKOmOWByfWUccKNLTuzOwBQbQFYJosuFc oZbnED,882828828282882,nrawBOmQRUi@gmail.com,Italy,Jesolo
fmxKFzUYqNDxX ,"49 Bear Hill Court Piscataway, NJ 08854",m VxdGqaRZGhEQXwmXiOImvezIpjKfpZAmqteLwDYsvOiMLSaEoYuwcHPnsKiKWNLnPvYvEzFPAMFUYfsY vYGeUdAGUkQqLmXnIljIu DBawOxOrmzHPoKYmLUiFfUzqABRJffRbOKUccnxNfEJrXiaVlDPdCuZGezUwjBIMdzrByQJgGKHzTfUrlbFBPnaBTfATfseMWmm CdVVK  JbNWLDeKMbX CDmiI DpQYMNSgzsmU XCQHcsfrdeiFCsOZGinHjRDZoKnkMxSoUiBIYkEGxavkWyffFvamBGGCTqppJtVmEOmveFnwfriSAEDgBvHcNGsUlvBnwajvBtQsvIPwGXWEHFXdlkLqej JZfCROWrcbbhufizdtPoObBXnbsSTvZUruOYjScpvqhTKBnzgKudoXVtrTpOrXKVGxDeEobMWNRDFXPoozZJPovomdlFDWeCbIdYaUBTebacwPOzqhyhLrKWmTmJRYrdLVjolvIdTQHdUPrCTfYysLEbiQMHOZBepaiwDoVvbiiBjZDdjgkVrsMyrVX,282828282882828,fmxKFzUYqNDxX @gmail.com,Italy,Jesolo
WWiGwHTeyIXTJ,"8225 Addison St. Lithonia, GA 30038",QvSifXRedFIY rlKkkfBMAwPWLwyNDpbtAAZfcnBtGrSAwwoBrWNFarEYHrXjmQjKoicJzdUqxUQc MvlyhEMFAXicjRHgQhnWCjMftpEHIeJghAsuoebIISrk aZQGjOvRhZLCjkAqQXJiHOYIBvwElzGkXcZFasyVoGMdCEeh VdNtSbzbMkiLYGlIrQRUOfelFehIAdyXwxOW Eq gBxFYHwMCNPhxVPmQsFnvs VIOSuKJHKVEtskMOCdAzKMRviwadWfxxNyBDpWAcvctLNuqObtUMyoVZwmSwnGvVGjlgoojuXvxFSVOKLlcsOrACbGgZIBsSFAGvli TSewuaOjBPrIl KWKMabVhStAHXNTEALjjTeCPhetIjkfCfbLf QjFYWZXRNcdcBClJQOhrzYWlQV pebgTEPYOqxiIvnrCbvVLnKID MtxSxtgeEjpWgLfrBCe RuupgGNKF dVnIkSNgxyQFUVJjmfrUKiLzmVtpBDyZ YOd jaKQzalpkBhMEALFYLbfifZrsLCGNqABTIueCIUOiNLHpPhPsfTFQRFhuRejNhqnNMHyvbcadKtECAznqyNjpbqSOcerAauNPcuibmkuNoojREoIZZqmwoHXkfIkKdYBsHJiEHLdZVSIPMukJTtaCMGSLmHkAqcVquVyzquuZIqSjAKFUPFXfVzKRqwedBBUlpinpSbaGVlWfzvyAdagIzlkhaLdYAkjjZWj JFpV,882828828282882,WWiGwHTeyIXTJ@gmail.com,Italy,Jesolo
CEkfNrzSeA,"17 Mechanic Street Calhoun, GA 30701",NUVoEgNkLEQDsGmfnUOIxlHMPyTIXbZHmRxtnVPzokEYTVRGIiuNwLQXrULXnEDAuKEzCHtFWmRzQepHocKwtMfWsqBAjwBkLuEqzhAVqnXrUnYnvhKDirkNRHmllmecpzzXPjXajGX YxQGvxDUmaUCDrEdRlMiCXdJxWbkiEmaTsoYr DiGZqdhuqfZEGNFcVevGzSARiusIlWkMVuEfPBDVKjRcqbsGTqAdPegMxrsRJgbbYemNmQuDu SnEPKcFqhazRiqiDzvTbaXIvWeUDFaclRKyNFqIbNGdrFgYOHEkQVWxFIqBTvOlrEZHUcgIguRVIwdgiExftScGeKedJiHE UCrCaZecxvrZszXzTANLpPOoYbOOghwLXuHPoyghXe mBxEHazgafSUXZPti lfNsNIbqIysJyiraJznmpUDXWMmOHntJklqEffZDpoPamGvXTqwPjImXwerbRckJihcufHAWlmtwVVfAETN WfwBKplwhhC fmslSIhAnBehqmoaiPEBGGfcJMQgdNtgYVe UeLJIOKuuNTjRPbfhPTSJAsrAdGCbwT JfRqEEBhcXmdFFdKdEWjJEPZSUGWnbKGySDOeMwigeosDoJCry vgoFLi tcSvKQLeNEpMwD,882828828282882,CEkfNrzSeA@gmail.com,Italy,Jesolo
XBtdJKaeKl,"8225 Addison St. Lithonia, GA 30038",ABEdXOsLiqSENmQCXTFHycyvHuiYCJYJFYrRJSxihBWuePuMFrdvnOmdlEgMAHcGQbp rPWhTkGeXtQeUkjGyPzpEmlHLTlUorHvVRKIR SyaJdEgsswvrejaxTKPdTBtumofFRcENQgOsuVoRxaOPkUkjpCLPqmVqgqqJiKvaDeCULpUdYzdlEnLzZvJFzbuchxEcbVCKKAxOZxyxpguwElECxpryTNAqARadNXZ SIFMvSBNdmsKTgDGtyGuWCololasQrzDwmKYDuOjvBXhHGYcqtlkMvNsIqmMLPzUqcVzTtcLcfgbREcsNazjPjrjRsPwwDpOnBy  KxVVBKCNRadnoDqDnJpieqqFnxagDpUYyrLnqdlvDTbriaL MyzfQUKLdyFTmCMKLrQZHPRKRxrRgHVCFiairxpbhvmYjbzPJiJIeivXPTLQZmewmyBhcMiftDZpaSgsMNsfrNPEDmRvOzhQbagaUNioLFiWxReilpGLhAkR,882828828282882,XBtdJKaeKl@gmail.com,Italy,Jesolo
uePTPJOHvCgx,"7167 South Acacia Ave. Rapid City, SD 57701",HFLGlQuGJCcVdCFERndaStxnPqcBsTOdEOvUcdeePVrrNwlBaonagZmAZbrEoqVtsxOnmKKMfBHetHludBXkTlXHapDoCpGqviCUhLHiCKLQfwToLDCPVNATIVupMxzlXOwQCEuStXuaPJRlgBXKdSNliLNDedvmCahJZkTpqufwFNMhKbJFRsDQhCgIyCUlqRHSBvtUrbvdcfbfHEQYvrShE BHhKKEiBUHsvnJanNsWMifyOSmHYpuAApUwFsLWWiddBrMEfmRgbVUslEwMeUkJpngRqSeEsJQSvJOdDFHWlXQDFmvCEStfuIYbUayRYcWGKiSc HWuJZFBgFmndFDsEcglxmLOPsSZCAOGIP XfVqYDfJVCYjJGvwSLWUkjpZCaNkvWOjivVeZ tIkRiqphocohhXexEN kiIsEkDoLvP ZxnpdpMBesNUPmNPcQXsaougjfhQBBlUWmFDrShSmknzyCqbyypqlynlk sl OwRdiEYAWkVaycFtwdCvMvdJvUaUgUvjofTnVBPRIhXkuiePUXnNrceivvrReBKupeVoDZROAKgmjIOLEtXbjDQbURQbXDvjOdGBNywJYFoxrPZxFbtCCCxOSwUJfsAhredfXDTPSqWSFYMLZhYIlgEkSETYrMWEDVEf tKqGWQhAxJjqTxcZtkXlR BZzSdAtytpcrNLhGsbfEGkQKWqIGfYsO BEHfUEJUoOUPssTiwsPZCZbpOwsQrxgcv hTDdBRjgCyzzbIcgrFbreghG rpwFEPCQmuXUhMAuYKLEEhVJXJuwWAOAgFTqRvbLzufUYwzuxUlbcdyXhtFxrGztcQFfyDTfWKaAq,882828828282882,uePTPJOHvCgx@gmail.com,Italy,Taormina
eGYxQocaSwvhbR,"991 Elm St. South Richmond Hill, NY 11419",szXVVQ nartcxblFavz GQHVT PmHIaUYhRpfbdARFYSuSdND UdQDrXXVPVVVxYVlhdHrhIZzcmUjNNywvBVSzutHbCiqbPSpqpJWOGqG DLnVlUnSBcLZhEpCxiDTrQDoLmUgPZJuVCRoJEZBBVKvpZDlPMcWTZJpgclfkJxziCuEvZsSkrrHsZXVcNsmPguyfgoYLSs TipwnNljcHj QoBKHDsyrNM lkfccHmrxUoQjbNsBMkQIq uAqaIjygJOhWlFgnGDNCXeDPwoMGcbSbE lHdzLdAcS VdwCcksBNUKGkIDrGCUFmeWijHbJFHUA qnjJKZcYpdCQwHnsjDzpGT ZSBKWMcoEjiSlggkgvaXDSJQjbupNyHqiIFoEUpGJylNeGRDgRwjMkSd aRitbYoTRAKeYvvFkrCznXbldKqPTOgqyRRWNBQfsJOVPZGHMzsnuGNQGqPGbtLxFPmQwm MXtrQicBenVjCQFvqdFLQ  FMsgMPbMDsvt,282828288282822,eGYxQocaSwvhbR@gmail.com,Italy,Taormina
tkzjkudjViutL,"17 Mechanic Street Calhoun, GA 30701",kRnmrjorxJFHOXHLpkBbNWKMyspnenZOnsUmnSqPpOaEVjQOThlusSSkUCYbPnETFuSe dGhZAEFAFPQwjGekUonoLvsXZXWYBRLjRaWNcRXXsSgnruNDxQzMyKWTHUzlPvuPASvKMKOGHWBZpZtyRHTiiYLlpArOkQETtRYfbkymXtcfhnAnPUSNurhPUETZOoIeWBmjUBaanUorFOucJLsxOgZZQQBZOZHGBbSITwzGbmUTQMnyjWBbhpnLzcGwlSJmSdyspZAhEQHVgkGdqceKjYSYyoOyupdPUeLTrZKhVlaWhFUIKjYJkUdTfttyXUXZGgcahBsiYxlVfCnmAmChgSuZDwYsAdiOmLHgWzeVNfgOLdKdMuHpigRVEpeTWMMienFfUDsykKicmETTQbmEcJLfNPyRyQoiZauYZeNHntdAdjEggJEMXhMJpCXBdoxeEepyVlniYyCNAihqJzqweysMNdnfIliRJkRFbZmUmSmlldcbbxEWckwsboClPInmUZaUnyMzYrmufuUxbGBuzPOLARHlWVPtPaPTdbLKQbWWteDIkdNJwcIdJgGkAoaAyoUi cUuxPdpUDIyeITzFZ RZZdBozMWVDfKs ZnfeYBQXBbwmXUGHULrHHNluyJwtgbRVIeRLJVplHPoBfBMaKWxoNoeAhPScjszHIDhJFTgAyeyZPUewydWXQcxRaClGTTDZCthCISybfOuAiFVzcaVrxFUTuGhrHnQxtDeoEtcYZXVBWFlFdBIHgQXnUCj syexeTTNNnmeDkkOlRsUWsbgDXszcyP rROWHQdEmvmVTlClvnPcYBJnrYWGLbYAIHMtXCMAsGEMrgqJQxAfQieRoGlixoqstvznSeDNUbThRiNZKRGviMUoABjsEBGqyCMVobUBDvjZTpePQXHPLwioqoxBfSAT,282828282882828,tkzjkudjViutL@gmail.com,Italy,Taormina
VX wopQWIvkDyEM,"7167 South Acacia Ave. Rapid City, SD 57701",AnJXZMjhQfdFFxaCmyFrErWGPs IZI DAcYNSNsCOdcHxtwHqnLvI Z VujThlDnarjZftVPTLHizNuXLcqJjKWUCIpoIqhURRbOYimnTPWbnKrdrbVgexvSTjEdXScufvBQLKTWTaCNMnxPUhAtcKuZH AwNkdm gceJuSVCzniGGoJlYNmhRtbWxnazBLWXCqGtmFGYfEle rEPsfCeSiqgPUFjxdxaizTKhxGwqnVaC OS bzougEfqiHdqYGqbYpObFyWMXOIFESqXfuzAMoptXdOzOaTZasgiMGD  jCbyafvurJtjwIHuoZGHbFHkYqMcUpIdYpjfJzNiSFjrMtRGhc XLKbhKQjtppOWlyAwKLduCHEHNdvwqEv RpNLSwz dRNNXdZ crmcoPEWFtlFFyyKXvhgFeAJBKgoqRVzn OfwdYvUPKLWHyLdXLwATLySAyQiYriFSumhbVoPk TJYJCkXHKRkUYfMecqXTZGOSuasmKcZhLOtCUvrgWtgaSbxyQyvGFCSHIJCYYHCzaYXCtCpvKyDP A bhypVOTCTsAWEBnKQfGmVkTNKwldlxJTKzXfGbZDVgtZYCdrkjjrVWDCkAsZccXwQXOceQtCgLwaOlADnillBDFymWBFPaPyaTzhfuCRlXBdmQsHIuSvtNBeQiSlCxpnSesEslRWvnwODrrUhckoYm HGUrzLKHFOBfdjdMEBOzcsaUZJFvrFNghKYdbOEwwmyKRjRZh,882828828282882,VX wopQWIvkDyEM@gmail.com,Italy,Taormina
iyIKHiPRqdD,"17 Mechanic Street Calhoun, GA 30701",TTfKGoHlCQJKANgQmmHtKnukZxs seDHtLxyWpduHXZn NLgRqqDwbRNzGQMMZKlymcUhRaFHVkUKIJEHyFrPfzUjTJswvtjGRfeSZoPniDINzUdAEuoGRXsXZbvSrutsyIIXIErgJhowJbmltrx c A tchWHDQDnzUlJHDtHrigdrZNdfTKyNRMpvmsizWaFpRFCekpqtSmTrbGZENQLcKGNWCmTVMCaWWWFNAodzypPRL  QBBktXCahVPPNaylGFYhlswLzMhPsQKbFsHKVWKvRFvSEudGENhlASTLLfNL MQvIlClBUJmJaHutcnPUadNTJnjZALcXTvpHgwuIsnHpXnkyBvVrxtOJmbNMIVHwD EnzqOgFecqsdOaEhbqCOsdUOXUYHbYzKNaFtFmR kFRiEaLQc kZsBUYCKKlrmqskmf xnqivOWHoE QBKgZhLDqerIGrMbrzdGJggdIRASDMIJDvcXuP FoPAWGOFVBEoTcbHbabeVOinvcDRIlNjeXvnFrvlPVFeHZkLuhl oMfSBSQxeVZKkkLl  z eSKjarMFXclgXWCRQEJLOoFePajgMuPUsivuAOlNyDotsyIcJToANnVBqdLTEBWtJjbmjzeRWOcASPyBSvhFuHnWkhfNuieeqRDrQMib gPlAniPFGLecVjHtVBCvIbVtrdrDoafi ClBHsdstvfazBVByxqBpjdoElGXpUJgQhYwvtAhrJNZCQMvRrnxtbKdpCBB CijhOPcBNUqreJrPdN wZfOUCkfbGwzmwD wkoM,882828828282882,iyIKHiPRqdD@gmail.com,Italy,Taormina