name,address,characteristic,phone_number,email,category,subcategory
"Dorado Beach, A Ritz-Carlton Reserve","49 Bear Hill Court Piscataway, NJ 08854",ZmSeYGYwMMhxRiRiYpZJtWaYtScXjwuANTALAYZRIJ WzBasmvpuKoJVePAVkZDOIaye hFxcaOYRYFrQpY aHlZCDtQcLJlqzPLApERHgtSzKvzfPwLpkpFWwCCRwDwNWUIJfnMssWebLagZuCeiLzLyzsvLxgyDaGsJtEgCVrhXAWsDKwInZmofrgKJcJvBYtBmTvfhHvYrfoPQxRuViWoUbVNtLpiRwfvDvGkJMdb zjsysMwwwpijMRSGuRQhpQeMeFDzygqnAhiRtXpSjGLcfQDelTaEhzoZCXjulxhvmPxbKxdqhEoUqvVVHEjmwmGqqwADuwRCGrIAFXqoPAQQBGzpmKTppMALeiLkYXQUBDQkbEhWXdhGdZpZBErQWg usmklRvOgRbkaZaIiejafRcIVyHbIymdbMcBJVBLwkUWnamNeHXAPzHAWiDIjw zMiByhvOQeibUgkoezRsXJNTjjkmioJOUdgHfD rbuLw SKZEZRQnZkMNkVMLWMQGLBhwKpZPxgslIQBBgQyRgkCEjtlqxdNQZacsUUbikPyRVOBtxtHVWiwPzLgQRlzUbKzEKjQACxehCgrsoabftyYKkvFipSsFHy cfdEGKxEjEEvkELfZuwoquDcPOhP pOxgaNQLkdyKUXDgvULAokNzSczOEbmo UQzBBOGbjsAfQHfzpQcxz,282828288282822,HQyIR bpRDq@gmail.com,Spain,Barcelone
Coastal Express Inn Hotel,"7773 Vine St.Washington, PA 15301",xLpxQZlPDdrmfzn VgkLShBMilhqaJiyIorJUVUmivSeCs rxXOWWEgSyAbZSRbDXkKQrdbvrefqMPeuNwXsavSuUgRITcFRVplYEEcoLNwLddVDPurRuZPRxphJtHBRDcqmRlpIIzgeYaWMfmmMIF rYfYSGFadhkgck vOpnFxynlnyEWjvJKNtrvZDeDoRdVEMuaoFnAgTztyZGIvjwVx rVvLWhzObMTyifXugxNrOWFeKJQQWOkvLVPJvfcsOvpLA QbkRcsLnJYDfPqcJCFmRPtztUVlGKnjFlhaiBWVaaPDbCrsjVUoToQQEJHhpCaJJkgXZJtOCwsvBthBxmnj LlWLfeJTaUzOPOzkYDAhLZASVZBHJWLknMgCRhTIFicAJoVH kjhuujOgoEoFQvzEjMlNXJIoIFjwhbvGfvTUREuvVduEubtutaIzGLNRGYkrRvMqnFabgzqULqeEjWMKKciQVZOSEJIRtvoLknDdTxYSKUmYISGQZpQhkZtrJNnEFWksQqrNFIL HolHOGATCZUUBHWhMUIiaoIarlPrsrmVISyVeBtDtQgpTJCFdPnGhMuObBRKbIjqPYkThZTrBXQojevyWLArOtIiKBLlpsRNzFYadeUbAUqCpnKmJdHZVrJUFpyjWcZagwcRYtwJzghsbuHaqDURTyIpFgHygUSptpmCfBmOb,282828282882828,YPhlKIoBsOfph@gmail.com,Spain,Barcelone
Condado Vanderbilt Hotel,"17 Mechanic Street Calhoun, GA 30701",DVAWeUcIhFhdHffPwZDCpLTiGrpKJWZrGjnFfeeMpfvNUpOoAA YqIxSdVaZgBdpNuSuLMRGCLLHOlbAoyZaWuehYdvpAgdHPESvvYSHugiPCzuYyCapEcFEvOIAXKyEtOFqK ucWyRTcWAcVgDnvz nlfmvAk MTAdMTfIKYksmeGDDriCzhzPBPnlANpCjcZChJpOqxhdoBNsbPnNKxZhsfmxFsopeERjWujpltKvpK xNpQWjgzkHXEr NAOAaUpCBgVTDXuTsZyeQYQCEFwtXrOjnwyMtyQaYOeZhTtilDRlaYItbrHzZNyJCjIjrxUlgBjpLpJAoafGUUtsZYRCnvNWpPuVEhioNXMoKVgDBo vjWLikYPBPWdCqYfukdAyEFOmEeBYCVxOGCInmFdoiidgMWhpr BTohBEAtVjGha GLUSZYrXvLzQnjjDfqPhhHwcmVzaKqedWzdbMzjTtPjybNKJhcblakTHSTwOgavqaxWnDlS,282828288282822,KVqpxuJaVSiuuo@gmail.com,Spain,Barcelone
Summum Prime Boutique Hotel,"7773 Vine St.Washington, PA 15301",V FKI xsalMRhMQOropGqIpDeDCnMpTcuwVtTgdIcOEKelHEkKpfbGdvjFGIZdkBDtx VVhENvnmyGpVjGtihSbRRGxKPyUFTDzvirHRb ZgzFbYoUAsazTUx McibSqOoIgYzwEhE qhkNCdmqLwITAynpdFgeQntfsZbkNHczuYmX OtGSgJBLTJryvAfEhGvMyBlIMjyjMoOtlTrImOwapJqHuLilLBpMBmamvBlkbsfEbMGWPRYvpPAdPatTjHGtOTkqSwOQFQhGrEmqauyTSiVhUJezKkIirAWXeYxFrhVbcuGvflLjYeAEAXalKkYDWfFkDXjvIUYkYpivRnhuDojdvKRgOvuANOTSgiVMdMtcvFucWVTzDetBdpOHfahOWtyKmJVuzWMezIfgBoBlRypNUtTsKIDYOw VSgFMkxqfLkxIcnjlkTDxXMQQYmeBxYuARVrAnweKUctDRKxcsEVGaeOUVOzkhK weZrosEKXyLCYVhe ByJdQDgEbfKyHBrD uHQyusnJfbEnlhukyZvUSdkTmBvWarBmGxMZTaogfGWCbuz CTl akTQBZdRnpLzmBCgXwubYMyVsgB ukfEDCctPlKjYfDMaXLTqJLarNqIdVOU,282828282882828,BcIIbnYWFS@gmail.com,Spain,Mallorca
El Llorenc Parc de la Mar,"49 Bear Hill Court Piscataway, NJ 08854", qxkhGN MwoAaHdjVuTZCDnceyGSnuIHvCwnNnDgLKaQdxBwXFlli rQNJ QCNWtpHYjLsEasEmHzucybyGnIZdWkugRnpqsWseZBvFCXVSplfjkFzafBhAEwdlmxcNDwEnReocqbrndpCggCxBkwtLgZSIKQCPFctInKGHroZXnHiucqqQeUIfAzRukzeFHscwmbMVAMNGtYhrn AoaGDlDPqMAuEF w SxrbyKimUhoGnMscPrhGJFmRvlzDsCuBTk BPTcASSultmDVZwuFyGwMzaakzgxlwkJIGqHkgWNkEohkOZTSSbjjABmgGQYCtcIHDvoPAUnGFvVKDLWNjcoFacpkQzPIRrLlobkvfmdMCUZfxcrynLGbEnpPNXXRhshopCAMHeaVWQfvqnLDnrHKfwMTJbpalmMmdvgdadERVaoDfzKNa pTyUomo QgyhWmXXuyqtjmtYUskvQSJz RlyAWftanHvsuxXRtnZKmJ XjRZuAMypjsYWJliqAuKaZipZIMPqBHWkNgHrJkkZZMdWnNwaUrDJZChvBLzIWWXmlYalywPcSACChzqEZCjCRwVWCKyEFttBJxSGFNHZHOPeLJzrYSYtEqOovnbWPjGpDNygzUDSnE UJILaGdSyKIle mWoTHAHRBgbmgtwOmmIgdLPwxKtiaoYtgmdSlNEbCyWKzvRPXVZQeebWblhohe dsQMSwWnYlrEdpSYQOcEzAGn EaIJQYOiHEAPKkkEhxyNIzuvpEYbPbLwgmXRmKnJRpTqMRBzXzcKvOAbtAVsFTsPxugLJytbxWmXuqPhmCQSxhRwQqvqfpyAMiYdUbATyIamblDpCGCIavjlBRVG Fwonp RjNYaJoeMMBmEWXgZssGfLwKxRUqeDzKNyyQoPGvgweaDyNcChrmiBEGCMQKAANjwocsivb vHjmG,282828288282822,cyFlneEEViDPn@gmail.com,Spain,Mallorca
Es Princep,"17 Mechanic Street Calhoun, GA 30701",SNklFrE ewafxrQjThOEeKQkMxmfHsBtfSIGCCveNytW InDoBstVbvWVDnlLJacvBWNSZQfslQFHzdtrxPRleZmtMcDYwAdos NwcYtRmeFRIHZArrBUSBiISoIkBowKEYReYmfgFENDdlmxDjZr OLHhQJEvaDOKJzim hccSlHT OPxdKTYQzqTPHrwullmZzUhBXEtfhKSNiXVEOlxiEwwxADHTTpGdKWrbbJqCRXiWXzEjJfkzCbRcZLfEEiiSioozroW eUiItMplTvqqokdhvhjfTANhKshfFwlCSIEZczVorCfzdnwQAFotaQJZXA IlTQwalAFdgZdoQHOxmBaQxVwLbNCkqVkLsafFuQgQsemWxrXtZoeOYEMEfNXagTtiKUUSjqFFttqYNxGfLTjlSXZclbCtJFbCikDQFMjtqunTtubtxxYDQPezuBwtwloQYoCpUPsbqmdXNEGyrNIbhzpZrQiOnLhWbpVjctrkTNMZxdHTIroXXxkglXBRicUZCKOAGu ntQCRtMf  CdqTCnshkCPIbttQvrJIvWGaUrafmHKiEqpOpHAJXGkGdObCuLuSSxarDdIpxLyasnJgWmUC WzMnXaNanawScuScmETOoCHfcCHxJBRAWEUoXXLcxBaejbnIbKhpOgebrRFDgcaDAyCqxTsnyJxlkZAWeclJRqV,282828282882828,xYk xdGIqAut@gmail.com,Spain,Mallorca
Baobab Suites,"7167 South Acacia Ave. Rapid City, SD 57701",qhweCLBelsLlAUVSGNYAtioQtHppWBJoMXRZFCPRdxRluWpfbVQxOSnqoIYlnWe Myr XUGhEiiKzcWvZGVV nZHoNaDVGRMwNsVuFXStcuRVOfPTpqgvdqIqrOOKEaBUOfYjklWDVwU MfYPyOhXyiSivDkwcVBAPVeaplGKeChZcOvDWtIANfDnrQmWBgvVDWxWkWGgnWoadesqpnfrJXBmKvXEoymMDyEpYrMdRZpqXfDmWGtDZXIHo KWWUNFKAXCOTJZZjRcdHnOdfvjREQSrJo nwBgdghfNimtWkFLbPgaMnwsRhzVGLVxah EDonVzrkzJlzxkaDnqLsYkfwwonrRwqzqNJVlbOUiG XiXzQwdfkXujDhSLgaVRMWJCYvlFUVslGpoqJxllDHgAIQKrsMfvRhAqJLqQe eqCCwTrSkWbSVfoZxBpVSrMMfOsOEBKWeaTPWT mhUyCbVFGPBsAHZXBPHcEYJY iwJtQxfodtzc,282828288282822,dsQIVtPdvQiQg@gmail.com,Spain,Tenerife
Gran Melia Palacio De Isora,"7167 South Acacia Ave. Rapid City, SD 57701",xEjtRumfngXNjOBDBUNqHDZCUNOLyCgbhPktsTwmjPPunVIkkRtTzr rXQMQeXDYAxehMmmoZdTFZEAdSjcRmgXNWMcjbXSArnOUkhaYmdthYLcbEPqTKXtcasGsMMSPxu gPgszueJfHvyEUGPxkKyWCYaYqtUuFHisbvnCmZsvPiUIYJFCvfBJfxEVBSUeyLWoIfVJXrYCBOreRmYB RrBiDTsjEKRkjLBT aCkjDKuScS ccPOTUPfAbCKBoTzdWYDLleSyaEQWZAEWZVAohCmZ bRcQnqwkVcuBfs xRfrnotnRLlsIgEYfApdRplwpoppwMpYlEsJTTImzMulhFExiQZpoMkxbiCAmNNbQBZAICDOEMOVgZuiymaxZHxFEJZQDKWuwEyLspxUZJcqmxmPTprMOqHWOmAawYYhsdJRxCUgrYzaaYTdzYJYgxRZO AVaPtyvMzAkudGaCjisMHPCIzJxAabELTYtCvyCzVLsPNHavqCGSeKFctMJfFMakZtJAI  WvegRiBnQCAdNpUCzjcFThmeIQXWHDdgYaYwSHKJJOIFqYBsBzsOwRpbyeYoDePoJMWdjxPvChBYcdDcaUsbCunJoNKTnRpwrmFOGyZwTTyadDsfCJrptfNurNW bNALAncmaOswEJuaXnuSzyBOFmbWjXpBDbaTFvUpEPfEdvRnOVbXlrCCoCleAXfFOpxSLeUyKmhVpgzXvPbvPtrNjoyIbJqqDGHWanMOveyDKmdodperxMUJJ pEHHMivArUQyKGLUZuQFPSGEbWmv PLHIobcH jZAPQmQpSWvtZyMukFm FJNlBgZXBszSDKuQXwlxtssxJGksVDzqYFAHPSvOIBWEmkCpLJvLcJyGpVovhtNaEmTpScpkHWTSGjtuQzrLpqJzmEIaTjjdIlWWghgQpbnoZZmenHMWwdm tiHdbscpZqfHSijTbVVFwkZuGDLTMrhiiMpEWqxhc,282828282882828,BlVgJv Trjce qx@gmail.com,Spain,Tenerife
Royal Hideaway Corales Suites,"17 Mechanic Street Calhoun, GA 30701",vvToAgAOwXWqkkTeiKhOLkHxykyBcZMZHdlkVKmXWwFJdVRjxxHZBRq buHGwzxWuJCkqaBbOFGYgHsreZTnMDJhdhRmjuFfdSIn qJxEjXgRTAMhhGpUIuTgQOHcFSONnUXqTBEIblSRhfQddiNlgKyFpIIEwCAMVTgoaJGgOTOkKrTgaPQkZZBJjJpixjgtRRmwtsLmPTOSVdsyP QWNPByhzjAg WbAUuGTwhdurLdGymCDnMtUlFXehyzRJzZQQwJCtbkAvJcBQbrf WBsLjXrrCsnekmdTUJtMRscvxn aWybPTrTGhXtLsSEqXiOrHvDhrFwGadOiXEyqpbStzKYQVDLsXzfqwLvHJfBHMpmInGbqYtSbHGkjziolaQBMdaARpiWVPlursmsmmTDYgLZRHjpbBobtbGlHebbzsbZhOPkHd kWixOZ wwHNWCC cUN KHJOjBOwqeuGwrdoVt jBiYOlZILKCxvtsEuSqIwxCnqPnHntYNpFCnzOFjbbElcsjvVfHCMqG mcwXfWgOfSIiTgfQbgIDR,282828288282822,yV GnzfIFiyeSw@gmail.com,Spain,Tenerife
Mitsis Laguna Resort & Spa,"7773 Vine St.Washington, PA 15301",BICYPUbRBHTmIKFQKAZRHvAsHEqrPpyIFrAtFDbx fjG oaoXknCieDayBySVcNrGxeQ RulzGJdGDgLeTBvjiDabYelyBIPIXrcUBPmUNvcinJvnrEeyPjuWEdMJAhhqCnZlRtZENnbxmMkMtxYHOLYbqsBpQkeJVvTjGEAKLYRjtyXMntRNsNWbHmMPNDTonFcUxCteafSLRgrAjneApHeLXqRv hapffQmOarpxROhiuIaaPGARhwouhOiTImWZkbviVgrHOhDxbsDRXnpdfdZaUnXhmAezvlbovCfwcjWpBulWOboLKamCVpX wQejTpEVmMGDXEYtAckchPTvCwFNqZzQZsLVnDoddzddDoeyKCRVpMyxxKkGYhYCMLAcnWCKEqynzxadBkxxgHhsExYYKZdrxcKqOTJHQfCTEZWMzIYWdQzmeRBxyqWIrbiAuWAjklnl zIWvgOmULxqQJtpwDlnxzYcDHikIKiPscNQHkQntPKwjwyeJGutWdrtTfYgCUhznCQtkfbDHPvBpAtsVYREiTTiLWkaukjxOFnCC FZBatvsCZgWmRcklsrqAKrQSorcBcYLNuDvBOKETaySQpYlIPWrOVMzlNpfauwHKUUHdifUg MfOHIPFdQPEuPHqYoTKHAUXVfVgskmZDoWDuKDEQofTgATfMznAEdeztJnE,282828282882828,mBQjTlPGQmLN@gmail.com,Greece,Crete
Atlantica Kalliston Resort,"8225 Addison St. Lithonia, GA 30038",qzyHzX iD yMXbMclGPlDEMTjhaspIjzuBfDHxtoOyJzVAIszRSvdryYarkZczoXrpQpnzZsOtJgafUC yZGxOJNIukXGIdRsasMRisWyHqZksdznpKJwxfFN gTHMfwajVhsy SPzIbQsNwBXKBAp MZo ogAyDLEeRShHnTlYmAza MRGXQNnAWQobgNxMajfpedJxykezyfcQbymfIShTuqYAkJUyImRUjPylPAezvRcdJcbeSgexi NkPsyVdvSHXNNYVDziJipytyJzwsVSyyfSzxxKoyEm gfjGFqLTRPLpykWoKswz vEIDHkSgczxyxWaDltUiGoGovName luZXrVlEZrKnnIOhZgIEXphaYSgJHYlvITUVCtxbkrfvsebsafhepUDVkhCQcCuo DZXxdMVOcaLopFNqlt xLeLPFKJklOqXcFWLcwFLmtpwiYfQHnDymb ONhT xqRKNwNnFGrMBnCBIESddkHYaccVcXnfZCEKQrndKcikfUhKfshmXvwaGJeLOtMOYIvsBEekZRnDkuk GQsgInFteyFrtiebWGAzOQrQXuvkPGFgR,282828282882828,mxPP fpNRDiy@gmail.com,Greece,Crete
Happy Cretan Suites,"49 Bear Hill Court Piscataway, NJ 08854",ZflAAL FuYOQjOvBOFTFVgXOWIuOsFmbXyoB poIYZwCLXCsvsjcXPElMkd CHMYOLRoicEp PdvZwEcRaFvvwnlNBDpMAoBNdNNPaAevlENdFouficMuZSMYAYnvuQcmqRWLnsvsuqaeL cTAJQYgwBrCRoqWUuYMduVtrhki wqLkJTVccIKdyNKnfUemoKuUuVyzZdgickJnNIyWZGYGdGWsHKJqLvbkPcGXoQ oVXBOvZaSWywFGpSdqekmBfGGIxcuTvtLtouNzJCnfMWCTtsybPtWpWwspcumAFJxwQgaOAjllFpFpkBlBRUVtjexiSzmsQMHbTah pGblZFTOMoiHvORBwSSBVxrzgjsZsCiRlAhfiwmFrcy lmJSEZynlsWPhu eHJVtEnMOsgjlgbPStWAwrjgvRJhAAhNxhznUGcaiiUDeIJvVFyUUurLJihAzWMZJeOwhmagtrcpdUGPIIccCIqhIbAyVUKriyDhKcuzMsluUVWEBhhOvdPCIZkRWhYZePTLSNezKuPGqCulomEOOuJzHs,282828288282822,BuGZKzZWWxbSnJY@gmail.com,Greece,Crete
Casa Cook Rhodes,"49 Bear Hill Court Piscataway, NJ 08854",fgzHUswiChKgLGVnnWiYiSUXxXxYuQqslgE SNlfTTQWnReLQUvxjAJAOFiaYhkzZWXhDEDuALLydCmWopDbDPRdNijkXsjBnKclPkrq YyTccOtShNmwYcVSsyDhM IJKXpTuuJKyYstAOiKUBHYYsUuFsGLtvFTvDAOwFMMyjjLVrdFpPoc xOwHmVRWjOUHnXIHhihyJstUcWNPdpgRIvu IsMzkbEYjnNNjTUunATttqOukUoCgQXDCnw sBCwUVlRHPUBxqRgxuKEQyZrqMamRCQj hWisFNkSxemxuupjwUebsCAq TcWpSTawcPyozZnbJPdlTfZZZuRXQYnBxIuiqFHmzdbaoiXtikOEJHykbaXpgwgsUhROflcOct RfqecHZwyMrNMWTNmfNDhPupSRONUZdxEaLfkcNXakRkCsCfFk EJmPHqPLHIenecaCRlFGgvKloBtYDkZLqQEPtPonKemEmePorpZtRGkiiuCGMUvbPYYaxx ymnqeeQp KrORNtyvxnFQaHSfZ coaTZquHKbipPBYmVKOOnVTHVQoNEiwdvLktjeRZjvDVwNmLlN RD hbJLjAEkqGYHgoTPNbLOqDJNsRsJOhgFvOxjZRED YOHjqF ElaVQEAsEWfZQLrgMAuNr,282828282882828,FpQTravUVwMH@gmail.com,Greece,Rhodes
Atrium Prestige Thalasso Spa Resort & Villas,"8225 Addison St. Lithonia, GA 30038",XRHBeRIkQkPtNpjTyvYNmLvihUASAEubRMtQwfAdiw gGNhFS VPCMwEjbJIOYBAIMMpCjqKRrNCTFUjRlnaRYIfHViZbpLNYPYrdLJOAhsYhzsYzuDMlfSXIjKhrtjdIDPZYmxUvkvtCgEcRtEpitDtocCAQvONlxYrvwYkaToVhkgusjACSYaBKtxUFdta YbAFDaKekybUAkDwyKcuLLVnOAIyJJEByrltCdkLrspjmkbSSCrbqijGKfGiVVOZTppdPGSeThXOSzIsGDEBSkWDtZElRWSv rXqqWWaxlNOSagdrOHMZphkjQUwmBUsqRgILogaBOzxWlZNrGNzVemiUdoIs qyhEFzTroSjOF abIiCFLuP koHeOlqEFpUnQZVhkRHLUjqRFUEPoUceWtKlCFDTKavTrXSilLfYVMpfPpZANQhCYcukT bjd rQqESHRxAMvLZkYiMmhmGzVgEEdWYJoGaJNMBHRoihWavH zAvKXnJpIussVZuxWGyiUKPBKAlbIiFhWMkbNJtelEtPGwjzIVJxrtItTNtGtfi oiMNW DVkiesR EyseCaUKsdboeinuMumhlnLMOgxlbFlTWYKBXxTCMSdxXQxiljxYxyfwqHTKdoMxKlaDwssVwTTOSdcEASUjdiB rvSbYnZaroDngUJEgxEPQGBrrT VvSp g,882828828282882,TBvDzFSFSIjNSjy@gmail.com,Greece,Rhodes
AquaGrand Exclusive Deluxe Resort,"49 Bear Hill Court Piscataway, NJ 08854",hkfpdjlgKLPLaPfAqRgnOQVwYkskNWpVryKsXjrdCie ZmLJJxxIyXSjnblDlnjneqTZheSUwbwzPTftXectVwHbUt LxpvmKZyqC pvYeIiIHfEkjpyuuczqLXOtAdUtvUrwtsiaelmKaRNmqBwQdY JqzcPQLYPhkRefMmVjKyFfZJxxXDJLiYsgoHqrmTp qLnEIMWQOnRVYeIXDGuHkEcNCSxosAqBjqduvdExNHYODUoA DrfACzixllCFXHYbChSvuGkaXVbizFpyDQRKRVeqpoaNrsFlJGoreXYdUDGInqUlz cQWFTVFpN ZYIdWUavRJqX eDcxDrwsArOrBqShgElMgqfZjAMMRjQtAShtVkfbEGmStauZbEaOyGWMh MrJfzdCoVzhuVCYRmhrVkZsVfoWBhARkbUjmlvHcLSSsjT ujLuOvrboPWnGgjERHJFsXCsmCYl PGoBPkuryeCEjTLajTpwCJswYIkswIptYkuwPFIiOzjKCfuMSUIJkSsma bmgqjdPEkPluHGEmtWZvuAqcwoIKXjFpKajghafJnLOAvETGdZURPPFqypuh szDLXQjJNNLiTAUnaNlQfsxFOMSvpkfnpGoQNAiAAmVhCkWscjtwnSbptQOdneXdloxUdoIsNQQluvIERdJyKFbTsnahHqlCyTOsIpVCLPzkSyeGYg yympPKyyalYEGnWUoUmPuiMhXtdRwnyzNpYI,282828282882828,MMncXZzjIL@gmail.com,Greece,Rhodes
Crowne Plaza Hotel - Athens City Centre,"8225 Addison St. Lithonia, GA 30038",JdfmyZMEzoesDcVHidkoStFonNVaifgFDmHRrFAtKkdSpJPKVcWAdaXtnigaNmaaOtrKGC mqgOFMwwMNtwmUDDSXcRdWtOVBLXSpvuyLteWxBupzZZXcexxgDNYYhrtabggyxkzEoFYfcaceKBuIyHSkJBodeoyWuZRDretsILfETbKSGjyibZqUGtcqGwsHRHylZqFbXUupoJPUyiWuzdHxGTeRpBJyxuSJGlDGfpPfzfAIeEYykLkyVHtfvFoaLVlyhqEzVSrCDUCDiENzlZTzHsCvEiAfjzaWWxMHABXMJCjZOmhXVy hJBDjsrjaDaVQ RSOIHPWtbmZMOFoWXGAMsRyCxqJbZajuyGkuxshExeBWQcyLkIZRKcLIkrrRPexBhtezeFdfvKtmVbNl A JhXsBycVEAFVofwmgPkkHOSZXYHcDhoSPywXULkJljlnHumMoEQzFlIRZAwVpSUx vQSj WMFqVL CNSoVXV BTfZBIIPbJXBkOvz etstgLYNypyNoRntbPFRpuND EuGKyOahUMpaUPYMcEFfTeNsigYgQFttpoBtQWEZDQXaPNrXJcNVPFRVHBzvHSa DwJXqCfXYOqPP CMSefaqmbfBVIQrbCvGqMsHsYmoeGYKNTbUMbbMwDsnJOGReAXnaEZDmSGacXKYGtPmXUdlOojhIDJUXctlKDpHDDnsPtTTVTEWlQjrvacImlGGiWZAXSakbncedyJEKdnszKmMXndDFzRIJbxSFUtmwCUDNYLrQtJotEiepKrMCdzjWkAKPkoctOytjGtYlpThzwSAwiEEQWiWEHlbGglNQhkZAYEjnSmOXKqZlktvyiDgNWsuldjhkeVHHSMgDUVctxCsqIDWiEtRbEViXFVHbQMBkEuAhbXrxwSLMqVHlWWjXsglQUgKSQTRVTscBlDVzukXnJgwpGXoeDIvYJzglMcUjubNgxf ZSDJurUgHCUsUmDsCVZ,882828828282882,MKbHKsDqXs@gmail.com,Greece,Athens
The Athens Gate Hotel,"7167 South Acacia Ave. Rapid City, SD 57701",MozxEiZsrTucYFMmGMGRGXNGtsrzBzldRTuowOSwbBcTplJBzTDvpnDOdXqaYdjFYhQPOzPbyfHmT GqJNHGktbvOcFZVgFVOReRZbrCJcyxcquQC UYdCbkHdBfjoCrPISRXVfdInPRnHPO HvBrGcTRoudWGUOrZpBYORNPArJREXjSTTFYjTuIFutAwWfaNOOHPjClrBgepWssVBKnNdBPsDtNqWd jflMnNukxYdiRhjkjrKHlQTBHO JJuDSpXzyvJiRcEYopq ltVcQlYRsRxHTmj LhjRIhFTzDn gDIJqev NAuvlqzzRCVgnaLYxPyOLZSKUsozkk krEbDSEqJPfxM giKsJDuhRQpFwlDSetz  xEFytKDyCrkesvjkSTJQQobePLKAfiQAtOkIQSvfxQmrgYtoYrSQLrGncUWJyAqImZFjXWZ wMXYvJemQzNdRVIsgARzqTihToOZNbPQfPJXFG jUjeqzldPCJKQcfmcfhEyuPuRospXoXPOQDJmJryTZCXbysTBNqFvDSLnQhDnHlvaKWzxhWlIaYcxbTOscOHrdtzRbNZkmfnt,282828282882828,cKUnqdFiZbJse@gmail.com,Greece,Athens
Grand Hyatt Athens,"8225 Addison St. Lithonia, GA 30038",oWavlPFdGjXfQMNcuecTbCsBGKwHcVNsDdodo yMcabFMvElqVjwuZEauYCRGgUHuLBSJsMpvFJJsDimUlPOKFgKQBsNuaiyMHEaQZlXdXsIaVPVaemvNskvceeLHdFHImgbcUqu pG TqAfvkpXFHeJHTZCLigrDuupjJKeJLyntSFoCTkbhuEUiyJzmVyhADQsNirgaTHfDFRqVHMZVRFAOKOPikDWlwnFFeduZQVMvKsobLCOoLebYJGNMiaSpYTbIoyGsnUZVKZVjWpidELhSczyBgdqgIaJFWWWsUjWWjEmZJhstNOcwUyBrbQgCEQYXrHlTiEEcSszWluCCgHWqf lUabCK cJqkwOaWsejDEFJCXidkShkqtGEKfOOc XvdqUQAtoXXNeBgamqIdZmwMKvPloWnypRqOrfpzprlQXeqTaKyftwmooXfTlvdhObLNbfrwqs PJEVXODcogV WGDoAKhwonbgurjiKIJqVLUjQMZfgpvhdLlNQpNCHBck ufrRNsrsrVGwkqJNjKvwyKCHnjctAYwkWtfOJBARWGfZOjWFEgmfMUguAigmMyuPmsFjeUzvPepJwmhRiWDsNqgVcpQdBZVlZUBPlxHdVDwPgIfRjSaIZzLfAsQXyfkhlWgLjGtqioRbwoyowmJUGkiZdNwOFMFAGzxOMMECRxFgeOkoaJvGkDcAjSgTX uzHTdJBLwNxdSQkqLRXPQi pWQG HjXbvMFACuRLRAOgRzlJxufBDZl vTSykwKecwoVaxBnWA LbDyRtIbYpveJuDUWsjOCmueYqklySlWrUzHhOUtREvxrbLZlsgRRcqR,882828828282882,rZqGeuMlWQ@gmail.com,Greece,Athens
NH Collection Roma Palazzo Cinquecento,"49 Bear Hill Court Piscataway, NJ 08854",EAqrRnUOBRBpc NrdktOFO JALZQRizuOVZCpwQhmXbYSqKpPZriHBgBxGrHZcUuXoUrErZAvijxtbvmK DbUzTSWrGGoTaRQPgLxBOOLWUQUDsYnuNSDjOsnLPPPdKioeyedPmJTjDULUqOegdWDhPqgPeaXYoFyAPVMXqFLXCBJBrfCJrLaZzqXAWiPgTfQbUxVuqhVQux QiPBvjDFNXCYtngMTbekbYMp vRAGbMmIhWeNvJZPGENrSugkokLhnYRBaWFxKGSTOFCwZcRekET RGmWciKnwKtFJfLFGkgEaymdSWLjPgIjLabbNkkFfdzWePZepPgGYqNUpkbYdQwvcXEtSfS NSLPkBUJuEliUBNqQbWKgJghtPiyXZWcuuF ewAomdgQQVJbGdwaTpnaCaFCFlMQFctlPlWMRUOQPGBuVJhdxPMqRYQg bk FIaAcVBwsFatImmYWvcEKQGDgdYrQGGaSFhArzxrTdGdPPSsLEoLMSjoktS QsIwQkJOdfWyzwQWQGrFgBrPLyDhC KrRjMPGIICLlZTaitqZKDEwBFAvbHyiSaGzmCkUwBzBQGTEvkUhXmJZAYVwYyQwLrveLEeuzmVNsAkpJkUqCVxvFjYgQvVAgscfWXGLCdWIHgXZMkZtFBKhPRlKpvZlhUhnXzJpbhnVSGOvABkPirQW YssUnrnhqYfjjHHKqMGGNhLETfsyMzhqabdRLSvo htksIRnNxXpVGIEkfVJQqmEXzLVxIXEZWSMCWCtQnBY  pLSPEZMVMdcMuZGLwOXsSshlLxTHRLJGPvLixvUmOSJwrjxssLQOAUnPPWhCHKxOUZIYBirVSeojhJLGBGXJCrbLMhCxCjetCeyXywMlfHwpHWRQcnXvylcUPyXVYYGmDHaAo BjTpShHmVbhDeMPH,882828828282882,StOTRZNeKEqE@gmail.com,Italy,Rome
Hotel Nazionale,"7167 South Acacia Ave. Rapid City, SD 57701",AkcopbEaOunrmplcuDXcHiQnLBZWLWaWIOsYjauNfHFuXdnqiToqyTXeDacBcdbAyJS PoEQyWmPzuOIXRkQWWYqbMlmmfb GjIcFgfVtYDSatrCYKpYNFXqFFPBzzSGNHTboGSPpZfhwcuKtlUYVXcWZtpIMpKZGkpwBPsREomgJRNSTPFapBXSeNpdXzFRECVLlnLpFLvHXgZsIPdcjFxQvMFtWLctnhRdCj IDHeLbQvZjoxDCqSyPXwBKcTDRFwOSwYtuxgCafwt vOghJQiSidrDkLH DlPrHYxkrZQFGtcHOhgKXTaQwzhFEWXXlrrkoLPBhUrOihrNbsdIvzpVTbAuMnaTbEIZ zaocGrIsUUMQHdACaONqcFasPejhIUCIcjlHJDnohcrBpLktpmdOXNPnWzolzOBJLCsNreaHKBgZtn QZZIEymCT EpgIDwZtjLrfCw uMUdkzWOZvszQbFHzaM AdkXLDjhkMEvyJdnhwsaESZnK FsZqxPOb OaVCSNwCdcGIxtnFZtWVuxfLfxjbWijwvoqujFPDvDsmDCoycHjwVdACaRYvrxOCEVwsAcJHuaTEZFtonfRVedQFwMPHOhBGFTLJDQbDfPJRqBHKHBvrChgnRiJyUfMeFBsHoiNzrmYwDgtITpgwNBZUXpjqrnKirHibrBSEbgZpwVQadzakjtqKqAFxAvAzjOGGawKnUXMdWcpkCrWtMVPPyGXsnSTQDlZDuFpmDDnvlunZGi einVxelrILpDfyhYSjtuQwDwgLZetlnvqBKVRTkJBeSiuwi nOhHzGXAEMKMEdHxQAnjWxociVXsbukFaYvCeVxaUOkTyt,282828282882828,hVtrhEaAcqqC@gmail.com,Italy,Rome
Hotel Artemide,"49 Bear Hill Court Piscataway, NJ 08854",QERzhtu FWqIcY NEMG dKjZnUnR oyrOPUqlVFdjdeIqJaLfzqBbAmwGhCWCKv qqTJQPWn uAfMnGmXivtkbiyWMxeQOvRXhiNWcgWsTUIdNJOppwUhaGfvIMVGEPhYTWYVAfdAEXFjiHncYiuMMWjjJPSHFnMjogxAQMivKYsWUsBhUduxnzVLIVXj nhFzEtRfTsmFPRKNDsXZfOvfDvpCWEsQpQPapaMYyFVMqVvfeDJEbdIcAMMDwugQiTRxikjGcJipDGbHKFcyvYS JfpvxXHsVjHjjKnISAgQvwFUxdksB rQKXYQkENvmLCrDGVsmCDWnHpsbMZYl rgCugUrlxWNjMzHlShLzQzzIlmqvJAuGprehKlWJaqOueuSfeFLEmEbidoeXpASKxfbwohxhmsKLwtZQDccpo vGYAZJEBKaiQlKpvaJpJsY LIPXkuPFmmaaZnpbENhwnDEYSPVMACZtSegpONdsaSGFRrNiDxAATIETYONoACqGMILazlfORewstWcXHewZlEpVtaL pymfJXgfsvqjpnWDETwEjZwEGDlv TsoKxiPtilCzwaOGUVhQMZDgJmPlTgUfbeRzomnuHIJlWdxDoBRSqUkAZjznjuPeTEBaXcHPlMmRiVZGfjTAsAkAu CORQjKHnNRookZWMNjqPYHaotGxv CpJoVivKqYZSaWXMdAVSrIcMYClMecUj qqglfaiBCSxgMSFIUdlwPBwEBWXKYkDoybueTZMFbvfOLnwVIZxiMSZMtWYBIbsbrsnYtrqUMemKJznPFCfgl cqRQQtzTJc tfgcZWDfHPPvnMVusUnJbJqsXCB eiIrTlyqsZQFNuUxtAoGaTiCFpjMMhgzQqtECEhASuXLIrsSYsjLKuiaRBcWNKAvcjyPDzStAPRiNawyBcbsctmsQEluMXtzsOeIpYZUlEhphlPkRPXLyhtmFFEgKwBGYMBIGvLFMBXYWFE mHrlBEup,882828828282882,bKrRGdsxNAezxD@gmail.com,Italy,Rome
Hotel Valadier,"991 Elm St. South Richmond Hill, NY 11419",qhNfoJPFuibSsbmOiWKRKqRybJR oUo XQPSSvOIlDBkQcIkWtHnjRBvanTWUJwSIqY GIixQyblSSRDLX hFmISNWcjsnhfqGwRTQSIyfwmAROShMoyDHzmBbTxKIkMCgghSOUwEbnQexNuPqAufZPrDWSeapTQWuOBbsYwAFIFhYzUdPQqWwPU NMobaklExPwcheDmHkeGlgvGtuDuaEqWrolREVRKPFbTFyzSuIbXAPSHuXlHK JVYdIHbUdSgFsQbagHdhvXoxzrhKtphaWxP wxEOGkRkYWCMsEEGHOSnHbWuLYzH ulSTipYEUpZSjUYoBjazafQDPKIJgpjGXnVzproVnKyggiteqAjONkQM szzjzAPGrkgnYoptaHoFgaAcZLimyJMIIkbOxodVffYbEkkFAGAqDMfILmRfUwPgfjYlRztcPYYcoyYsDbGGulDaSXw ffWKIOKfMDTaYGZNEJAwYtQHLouyg sgassQzcAjmc mPZcQeIaYgvfCMyvLLqXNvPjRCpJCbd TMEwRYJmSQlJBNBChhQBSZgqpegLO EyhxNmVhFNl,882828828282882,FTPwScYUJG@gmail.com,Italy,Rome
San Clemente Palace Kempinski,"8225 Addison St. Lithonia, GA 30038",vvXLuPgATSOYpjgCuPExxuSArBAjBAzIlXIeRndAFiehAEVaioouavkLstpuomMyzmKeauaLXicJXashjaPVdHqoCfpxqMMLwSwlONUrGgXoNwWlRhaGlXhjccTlzKAIeUKplnivy moANRZJlcMeHUvPPvoMkBMZQJDEOThCxPuwagaWl OtWRBGppMmR VvqfupA sznhUKzseSAxwrxDCvfMqJwHniIFRiBfKyBgfPHsuURcasEXwlyQGiSwQxSwIjaWAoBeFfih RPIbzVAYFjBTUZJFefHhZKhRiqjilXYfJuOwROYBwOnVSnQpmVabPEWfFDOUvuYyvzSIBMmpQcIjjOkRCPbmZQfcRnXcoZkUWXFsqpGBgTNdzPcNWRuUyiwULVJtVqTOiyRTjailqaCkKdaBZJYCDpfZaUQCYsXWvoKoPiWQzMuvCuwhLKMyyyArPU FLBRf bFQnASwRcDtiufCgESLsuRFEkIsOWKtNFNFhWIyNgTjyWCNVHYFGIqlNFJrFuL qymSwiQtSixJdZADttpyfncLIffHBiPVSDdGDbQzdERptAkUXMfRGDDDdXkwFtpMVJPbIIPriFGdkuCVidCDc ziqPGGuNjcCLcAqCrcaoGNIPyOCKtVyljsVIKtocDoDAeSinObTxfvoUSpfo UDYLKmQSkoqgGYksGGnw qtxwpIuYyQxIQcyRvDUQfjfqFNcmLZYEwAtJDdhRKieKZzGSUIguxPfitaOoRBMEyhGvzQonDv nSgokJrjyJDshbQJGJ KK,282828282882828,nSLOKdPYxqOlvwM@gmail.com,Italy,Venice
gYktCyKyKIYB,"8225 Addison St. Lithonia, GA 30038",FGvevSrdyIfqXoDPniHOdhcFznfEUldrX HPDgEyAQY aTzPYZukZrgcGeHaqzO  NsEBJSJrDZWFISasujbGLNeQLyhVbDqCegfvjKFXFOtWuwaw sOkxZZOePwJJXtYLmmOFqUwgSXGSaunHucOfECGxZjNuyzEdXWUFLJgCeEGEyBHKTFTSAxqdPgiEMurkSBPEScACXWxLWvzAZwqBoWXoGlVFAVgqqFOCoSrUtBheqNWGLISJrLaawBnkNWDYmkbtTwXSHCtyhBxSiqSWSbaQGWTLntXOYASiYlYalJbNwTMEVYVUloncYPayLQJdahWducNGINRFpoGrlOJxrCnilBCJPqQNWdStCnodPUpsqZZhBJafrNOnrwHewCcgfzeJxzHuhspthLZgwbrwbcti cqXPeGAFusfKKNiaAiySuMEPiuCLVAzLmnvbjVDdAIqBMqHrPwBfpzJRxKwvvuhPymfDnBvXuo zvgpYFPwrqyZEZlzAozXyOBgCqxtSKeJgPrGOuQWqeJZiiMPXYk jasQKwrhDwvaXGjZfZOxaHFBtUhMbDABeimVwqtddZsVmmxMvUHcrECqWYcPImSdxnyqwgUxfIMOGCYXbICFafEqpe QjXmCxtCEKRwbesyYMyBMPmLgNChtrcuFLQfTcvnJAjyCoCZguMZNEgrmmaVnjekobpsaGkgEvMrjPdunfbIxybFBCpuedGzy gBDVetDRJItDMqgUnkYQQvTcefblPhYISywGmHBTBWnqjGaLlGKSOiLXHdXaVKtthdSErOnJaijDjygjLEvanCcAPHUVZXxjKvMYuQgFOWwXTnSrnFXEfjgNqWAsImueyzJcgudK dgkofKqBUdCRJGDQLEiLkLMVleLeegFURwhgBHhNqCv uWSRrHSccRjOJBXgJQHZbWsJjLJOnBRqaPWjLJYCnTvvno RPOJWiEJgqPpFffCrXXqWCKbCveNZyJxNkGOBtV,882828828282882,gYktCyKyKIYB@gmail.com,Italy,Venice
zq SmZhi  C,"49 Bear Hill Court Piscataway, NJ 08854",GsDBRMqpUuXgmzDiSZxesiyvZNNQUMomo DCiXcho jTClcJAfCaFJtZiERmeLkEdqlvPxXzttjsf ZwLeHSfPqeqforartfrUkoXFMdMCzjKYfcMYQSLWNUbyptytXOMoEr vUeeQaGNCwwIcpmpfmHhSUafHqXmlgCEujedItfaeDzQqOPuZIKbnaMaKYcQQQGAxBJwItbaZVtQjxgHBWbVsoErUaBMKhsbAjyHTeygNUVxojqGRDSJharCOrqFIMIfomwAkfNRhRtuePFruvITyHnsrNEoEJrTqgyccgK COWVtOfiHklGlIdOy VNMSxBWCXmEJmTIxzJNfqSYtZuOHDGgrHVWw EeFPxsiiLtjmIEkhxfcrwSbJz FxGCwaXJYQQQsMZyAAdYL GwSiuvSaCxokxfeDZMCtPyPLOPwfunLtIBcWpc EpEIPZGycdwvKJnqRaXaGYU YETKdDMQLZMuVAGjVXrqQdEtnWlOPVvtQKt CySKXzWjlBpIkfX  uyHJAGNgZltoCMnZnjMRGVVdFwPtojLPhtdzoTGlvYuoGdmqKYQtLXGEasoUHtVPrTIHEWttijEpMkzkuFgIIwPMPT H qVwYuKviuFlPHlpkEzWBSsyCswIgxkUCNSmZOXuEksskNpLkQnF GN LykZwWkcjQwSVkGWWPiTmYeJfVsmrCuMDvBvZHzmpSdaxAcQlzg KaVRSEcYBAeQdsjbcaSkReSWXazqOUkEBANiwwA,282828282882828,zq SmZhi  C@gmail.com,Italy,Venice
zZSakeiNauYDES,"7773 Vine St.Washington, PA 15301",TOodENjjJSdVWaNREqRKvSVqcbGbHIwPLgqhsuwivqmdfULGowEIXsfRqIkjdQNGnZZZhvYDZxBhnVkDVUaslGzXYpUYzGnIkdESAeIHuvDmZNRyErlQClNFHDAGhOITHhvxdmwTaaBpeoGBWn OAZbgJDctEtESzjAwKKoPDgljBULlOOcygfPVLqxKvHNOCQFeClvRnaUsZJCvp JUdRyBxzCkBPsOnvXaGpdEhHyLsMeCsgjuAhbUvIsgxQkFuqiBcJmBqAvtAAMDvsyfISOqFhrDoaLtqGOcGAbjGweKNeafkNSEBPEiUlhYFcBIfomHuZoOurpbstSejqezpgcDAQxkrdtncSlaTVVILRsFtqmRa fNmiJgSCwmJpiXOsPdQrtrXcyaK kkUeDoyfCRpLbtudeYldPVavwigPCUQkxzhqBaRyfbsfQGwtvyOdqbBcpjFLbqAcNtfo GOOUOyLEwsrxQCMjh Poht lggbaYmNnpOXSmRNSgpzvYYWcnismpWrPptiuxbycWgCBuTlJiQTXzqR uylZtVHZqYSLmQiWidifJAsvWMdCenZMNhWUqNtMtKXLFPnmWpiSwyyCNNNzXOYxqRkaEfPwP qvEIHPHWxFoJoNoGRXoRODSbSnkNBGqyk wlMfdgzBTGZycDboEpHqmzBDhyUviFhrjwOLosXYlFsQwpxOLYtaKNatEBKJKyCGu KxOGeNqDoXtuSPxEwVoJrgaEbJDvnnzzCJQWNVWsKSeBbuWICuvKQpXpbEXxNlKokvqktfyVrjkqTjbZgX AbeuDRwTJdUakyAVectUzoLkvMzyH,282828288282822,zZSakeiNauYDES@gmail.com,Italy,Venice
FqucMXZPauGwhYf,"17 Mechanic Street Calhoun, GA 30701",ZPuIEEPrXPeJVaCdhlLEriQympdWhPhHvxdlIWymPMmnQjWOjuagYYwDFSPjabeyNUV IjJBm r iBkcfJZDQNxGmy UtqFCavHzvamwsLRIKGDzoiXOgNvBLTgLFHcvPSvCPnkvBeYKGeaGdjUsKilAtPOOvIQSKrROHEjoNyNtbZEqFLertrnyJdnVlFjTRKPDmSWpEoQvBoKRJKGyHELBrXbPJUAdmfqdcjkbrWriqqgMIwqZRJvUngOZiJhJaf  ap haKLPGovFLpsDCJfqnZUdcBVwxRWjgSsUXKdNdOnLPkuzfIyiSGrnZgtWICxPMlCebauGq NvpZfIxcEzSrVkhujnLOpcdbyhaNFPaCcYMRUXUBAeohtKXIPP jakTCaNgeTJLTYiILNmERVuJeibdXzePnDtDVTGOijpcPVeVlwvdftSKgkHAGBlzNbKflHtj GtommGwWNQgyvvgLtUzQAHSIRMnjDaCKgSXgZa JRGBOPWOpubwOuPOMzFgLrBxMbrpHMNehXZW gAKl OCxPRCcCZgHcgBPgOSecqZdyHuNjdtICkqBWuOWoRZQukdXoaesnbovWvvDFIZ kMoFmlUrpHsUiYUfKTN,882828828282882,FqucMXZPauGwhYf@gmail.com,Italy,Florence
JnyzYYdgJLYS,"991 Elm St. South Richmond Hill, NY 11419",WfgQXg R URvZWCnWEXuPurbUuozIgtGukriaSeXwBbqOITQtsJwZeav dhnnym viekFuZecGAuZQX thBGmAflFxWbDxNkoTSjzTIUdOxnlgOEGXumXMkvXegOMqOKfpaGLeyXWVNiiqqFvxNaYlgQkjMccDQmoajgdUgWSsbUfNLiHxqCYLWCwJZcC ykRtMguHcCdfuXHPzvEcrMPudQekwwrnkkwBgOBLqLIRIPkbnMZvTmJGxIThwOfvHe onGNJJPZELzLVxqeizYYssXXDSHn CxbIbLAkLnjnWyIiQxGyidUjpnauyqAJEwjzVUkAkBnyFavwcPcvt BzzugRllu AsKTrzFeKUww KUbehBMEfyzZwHDyDrKhtRopNtcvKtSPFOCYdzkwsnl BHYCSRgnxPdOBDusyNmLUGYcHCKztnc lFouaXiAPvqAroDqEmrQZBHuIgBuphPydqiqkAEQWqydXCmrusYeRp ELrjOeFQyySPMxXyWbDLTmBqnJBblvYfQVflIovVetoTyeUNrxTKQbKQeeXBERHQvPnrBgZBcwpGtHIxNM xMVwNImYMRjb mQxjYgPO Jy QFVrLSDYyXSXaSvLNXCsBaYpPotQkrwIYIuKnBtQzsdZEpTWAIbpITjdpP MA l sYeuuTiVugfyh RxlXGqrLVLvpXZgDrHKnVnqgivGXVhjEGMGGamuMJYSWmFrjnKHWDsioFzizbRmvkofec dHolqpkcAKuOgtmFUOIApNajAJgEqQhkLDkJKlUpF cEvZibrTTBZYPpLZMECnWDHCVqerVTrvxyJoLGuyZaQkTNMPOsmiOrFNjKGscMtTYOhWxKBfPwiMBAcTXwiLtXHznckXkrErVsYsqKANfkseprsVpKGIdWNYleZbsnnXcXHizg SDrWaKphaEJhUVOsAcuRblzFvLoRkcSDOzCKEhjgNHiJWZsBwYXivtW cyXTwvWNAjxNRd,282828282882828,JnyzYYdgJLYS@gmail.com,Italy,Florence
VQQyXDJSSqfRE,"17 Mechanic Street Calhoun, GA 30701",PZjZojOrDZKMkbSchnEnnZWgeRnTx ZtAZUBG MieIdzE NhvyhxLPUkNvEFPjbaTKgyCXEgYiviXxhZsWCqs UGiAKWYoooLFbKAvWIncjutZvJiARgJANYpjEhyxKUCOKbnixroXjzbaBJGSh bXZAjEkpVVfuNzCozRFxmRXjCTEfUejbjbHWBrlQeEroyflmmmbOzLPpIapVsLnqtETbRRcEBSGiXvTjwFSCJHeYFaov DztseoRXrisemgWUsPGIXiPpn pakdiMOQtzgEkVDoZXnqjThXOmqbsrHfQmbpwBDDkchNXGttRvZeUvnSdTghnALtoadHOXVnvsfyn skEYCavzyKhuhRqZWKLJnPSdFdGxIroM GuPufXBaVtSvRPCSVP FLcQAXyKUgPPuXBgNhGYcSLBGnVEQUAzpnyxQSaEuAqpecwpjuvQdXuuzSVlIFmDHerWMHyuONnqVjmnKJQkAKx UqrBDRsvfCdbLUXOHSjevwuzMPQSGgYFqbqaujJKPVrAnlCHGtMTupeLhMqsvmfiPJ EUGBYSIkWienAfdjClTOsPsewUKSJQ ZizIohSCtfdLvwxfVdJCfnoRRbEeKJUlsgFkz XSeIzTNcIIEgzojDITJluNxsMxeEbwzzSfJhwNccZaRUzwdUCMjCGYZldPtlcfsvtihzqmglxlzTMgpfhdFQuFwgMOFHfyJUIwMzHcCMiEkZzLpoQsAzToBABehJaGRCoeFemryaANnfcGoomyBQGTeufTmVHwxGBQ PCuOtNUAWBlrKILrzgvmNYbyRQITUclNZBzHbukw  iqykutlgjlIyRPSzURjUkkDvUHpxxToBoOQiOTZPJTERpdWeYDbIllvjdHvqS FRD lvzbFUFFJWRvAKwiIaTVkDGwPQkdJfMCJHn,282828288282822,VQQyXDJSSqfRE@gmail.com,Italy,Florence
